{
  "checkpoint_version": 1,
  "run_id": "example-run",
  "repo": "example/repo",
  "scope": "review the first three pull requests",
  "status": "handoff",
  "milestone": {
    "id": "initial-review",
    "state": "complete",
    "completed_at": "2026-07-26T12:30:00+08:00"
  },
  "completed": [{"kind": "pr", "number": 10}],
  "pending": [{"kind": "pr", "number": 11, "next_action": "apply the single repair"}],
  "blocked": [{"kind": "pr", "number": 12, "reason": "requires maintainer decision"}],
  "artifact_refs": ["artifacts/reviews/initial-review-summary.json"],
  "resume": "Refresh GitHub truth, repair PR #11, and leave PR #12 blocked.",
  "updated_at": "2026-07-26T12:30:00+08:00"
}
